{"distributionId":"urn:ref:atlas-fixture:distribution:qualified-three-machine-support","inputs":[{"declaredMemberCount":1,"dispositions":[{"atlasAssertions":["urn:ref:atlas-assertion:2b481ab0763f10a332843ac101ed17621fd3f168cfbae9e05a11f2bde0d3f97f","urn:ref:atlas-assertion:b407187d491f450ac3978ec620825004e818c8514c39183f958976a2cb87d3c4","urn:ref:atlas-assertion:d95f44422ae85bc83b0f99309a4339b5d91a63a0339646e1ef22a7d32939bb98"],"atlasResources":["urn:ref:atlas-fixture:resource:entity-agency"],"sourceRecord":"urn:ref:atlas-fixture:source-record:entity-agency","status":"represented"}],"membershipMode":"complete","sourceRelease":"urn:ref:atlas-fixture:source-release:entities:2026"},{"declaredMemberCount":1,"dispositions":[{"atlasResources":["urn:ref:atlas-fixture:resource:legal-title-recodified"],"sourceRecord":"urn:ref:atlas-fixture:source-record:legal-title-recodified","status":"represented"}],"membershipMode":"complete","sourceRelease":"urn:ref:atlas-fixture:source-release:legal-structure-recodified:2026"},{"declaredMemberCount":1,"dispositions":[{"atlasAssertions":["urn:ref:atlas-assertion:13adc7cada0c2ebb46a637402a0c7a13d4930a0787e728240281ce5cf5d90ae0","urn:ref:atlas-assertion:7829c7da0bd4d18abfba1a0ca1ec25e5495fb52a53dd45dc9187c8215228ec36","urn:ref:atlas-assertion:b751e4b6ed8b8cdcc0c5e26b30ff221d3ca25cd66065f3a8f02f9864f25d9de8"],"atlasResources":["urn:ref:atlas-fixture:resource:legal-title"],"sourceRecord":"urn:ref:atlas-fixture:source-record:legal-title","status":"represented"}],"membershipMode":"complete","sourceRelease":"urn:ref:atlas-fixture:source-release:legal-structure:2026"},{"declaredMemberCount":1,"dispositions":[{"atlasResources":["urn:ref:atlas-fixture:resource:mixed-code-subject"],"sourceRecord":"urn:ref:atlas-fixture:source-record:mixed-code-subject","status":"represented"}],"membershipMode":"complete","sourceRelease":"urn:ref:atlas-fixture:source-release:mixed-code-subject:2026"},{"declaredMemberCount":1,"dispositions":[{"atlasResources":["urn:ref:atlas-fixture:resource:mixed-code-value"],"sourceRecord":"urn:ref:atlas-fixture:source-record:mixed-code-value","status":"represented"}],"membershipMode":"complete","sourceRelease":"urn:ref:atlas-fixture:source-release:mixed-code-value:2026"},{"declaredMemberCount":2,"dispositions":[{"atlasAssertions":["urn:ref:atlas-assertion:36a8acd8b8b7cc3b689d85adca07d7d5e29d962926b5d424bd42e8e0b9b6d1c7"],"atlasResources":["urn:ref:atlas-fixture:resource:subject-a"],"sourceRecord":"urn:ref:atlas-fixture:source-record:subject-a","status":"represented"},{"atlasAssertions":["urn:ref:atlas-assertion:49d751096302c19f09fbb8ac5b6289f3da33fb54bdf895e06c3d3c19e4cc55b7"],"atlasResources":["urn:ref:atlas-fixture:resource:subject-a-child"],"sourceRecord":"urn:ref:atlas-fixture:source-record:subject-a-child","status":"represented"}],"membershipMode":"complete","sourceRelease":"urn:ref:atlas-fixture:source-release:subject-a:2026"},{"declaredMemberCount":1,"dispositions":[{"atlasAssertions":["urn:ref:atlas-assertion:978981a092a5c2dc323b534653ba051d76331ba1c77d6bfc49ddf32a9e02a96f"],"atlasResources":["urn:ref:atlas-fixture:resource:subject-b"],"sourceRecord":"urn:ref:atlas-fixture:source-record:subject-b","status":"represented"}],"membershipMode":"complete","sourceRelease":"urn:ref:atlas-fixture:source-release:subject-b:2026"},{"declaredMemberCount":1,"dispositions":[{"atlasAssertions":["urn:ref:atlas-assertion:dde2b39ff21ff26b8760b4c748fc278cc04b60d6db2401ca1aa5dc360e77c608"],"atlasResources":["urn:ref:atlas-fixture:resource:subject-c"],"sourceRecord":"urn:ref:atlas-fixture:source-record:subject-c","status":"represented"}],"membershipMode":"complete","sourceRelease":"urn:ref:atlas-fixture:source-release:subject-c:2026"},{"declaredMemberCount":2,"dispositions":[{"atlasAssertions":["urn:ref:atlas-assertion:0b1e7211ab031b1d89f3d2045ee605b0a7caa4d16b8ccdf6217e4b9e0116d034","urn:ref:atlas-assertion:2b5324ecfef986fe10c63d9f0e25bac90a886f3fcb984be63901e18ee1f51234"],"atlasResources":["urn:ref:atlas-fixture:resource:value-child"],"sourceRecord":"urn:ref:atlas-fixture:source-record:value-child","status":"represented"},{"atlasResources":["urn:ref:atlas-fixture:resource:value-parent"],"sourceRecord":"urn:ref:atlas-fixture:source-record:value-parent","status":"represented"}],"membershipMode":"complete","sourceRelease":"urn:ref:atlas-fixture:source-release:values:2026"}],"totals":{"excluded":0,"represented":11,"sourceRecords":11,"sourceReleases":9,"unresolved":0},"type":"AtlasSourceAccounting","version":"3.0"}
