{"distributionId":"urn:ref:atlas-fixture:distribution:skosxl-hidden-label","inputs":[{"declaredMemberCount":1,"dispositions":[{"atlasResources":["urn:ref:atlas-fixture:resource:entity-agency"],"sourceRecord":"urn:ref:atlas-fixture:source-record:entity-agency","status":"represented"}],"membershipMode":"complete","sourceRelease":"urn:ref:atlas-fixture:source-release:entities:2026"},{"declaredMemberCount":1,"dispositions":[{"atlasResources":["urn:ref:atlas-fixture:resource:legal-title"],"sourceRecord":"urn:ref:atlas-fixture:source-record:legal-title","status":"represented"}],"membershipMode":"complete","sourceRelease":"urn:ref:atlas-fixture:source-release:legal-structure:2026"},{"declaredMemberCount":1,"dispositions":[{"atlasResources":["urn:ref:atlas-fixture:resource:mixed-code-subject"],"sourceRecord":"urn:ref:atlas-fixture:source-record:mixed-code-subject","status":"represented"}],"membershipMode":"complete","sourceRelease":"urn:ref:atlas-fixture:source-release:mixed-code-subject:2026"},{"declaredMemberCount":1,"dispositions":[{"atlasResources":["urn:ref:atlas-fixture:resource:mixed-code-value"],"sourceRecord":"urn:ref:atlas-fixture:source-record:mixed-code-value","status":"represented"}],"membershipMode":"complete","sourceRelease":"urn:ref:atlas-fixture:source-release:mixed-code-value:2026"},{"declaredMemberCount":2,"dispositions":[{"atlasResources":["urn:ref:atlas-fixture:resource:subject-a"],"sourceRecord":"urn:ref:atlas-fixture:source-record:subject-a","status":"represented"},{"atlasResources":["urn:ref:atlas-fixture:resource:subject-a-child"],"sourceRecord":"urn:ref:atlas-fixture:source-record:subject-a-child","status":"represented"}],"membershipMode":"complete","sourceRelease":"urn:ref:atlas-fixture:source-release:subject-a:2026"},{"declaredMemberCount":1,"dispositions":[{"atlasResources":["urn:ref:atlas-fixture:resource:subject-b"],"sourceRecord":"urn:ref:atlas-fixture:source-record:subject-b","status":"represented"}],"membershipMode":"complete","sourceRelease":"urn:ref:atlas-fixture:source-release:subject-b:2026"},{"declaredMemberCount":1,"dispositions":[{"atlasResources":["urn:ref:atlas-fixture:resource:subject-c"],"sourceRecord":"urn:ref:atlas-fixture:source-record:subject-c","status":"represented"}],"membershipMode":"complete","sourceRelease":"urn:ref:atlas-fixture:source-release:subject-c:2026"},{"declaredMemberCount":2,"dispositions":[{"atlasResources":["urn:ref:atlas-fixture:resource:value-child"],"sourceRecord":"urn:ref:atlas-fixture:source-record:value-child","status":"represented"},{"atlasResources":["urn:ref:atlas-fixture:resource:value-parent"],"sourceRecord":"urn:ref:atlas-fixture:source-record:value-parent","status":"represented"}],"membershipMode":"complete","sourceRelease":"urn:ref:atlas-fixture:source-release:values:2026"}],"totals":{"excluded":0,"represented":10,"sourceRecords":10,"sourceReleases":8,"unresolved":0},"type":"AtlasSourceAccounting","version":"3.0"}
